release_id,album_title,track_title,track_position,duration,year,country,genre,style,artist,source,lyrics
33658686,Furèsta,Oinè,4,,2025,Italy,"Electronic, Folk, World, & Country","Folk, Experimental, Antifolk",La Niña (2),discogs,"1 ContributorLa Vaca de nena LyricsTaaaaaaaMooooo Aactivooo

Ajajaja jajajajaja

Es que ellos son (qué es lo que ello son lampo?)

Es que ello son lambones

Jajajajaja

Ello tan (como la vaca de nena)

Ello tan (como la vaca de nena)

Ello tan como la vaca de nena

Que en vez de dar leche lo que dan pena

Ello tan (como la vaca de nena)

Ello tan (como la vaca de nena)

Ello tan (como la vaca de nena)

Que en vez de dar leche lo que dan pena


Se tiran pa” la disco
Sin un kiki

Y quieren Frontear en el V.I.P

Me va a dar con esa ? Banda pa mi
Que pa” ese salcocho traje “aji Titi”

Somos duros si! No hacemos mezcla

Tengo las mujeres que me mandan las remesas

Llego la remesa ponla en la mesa

Eso es pa” que con mi coro no te meta

TaaaaamoOoooo AaaactivoOooo

E e e e

Ello tan (como la vaca de nena)

Ello tan (como la vaca de nena)

Ello tan (como la vaca de nenaj


Que en vez de dar leche lo que dan pena

Ello tan (como la vaca de nena)

Ello tan (como la vaca de nena)

Ello tan (como la vaca de nena)

Ello tan (como la vaca de nena)

Que en vez de dar leche lo que dan pena

Ello tan (como la vaca de nena)

MuuuuuUuu

Machucando en baja

De paracaídas ellos tienen la faja

Una mala lo Ta ordeñando

Y no e leche lo que el tan dando

Tan ma pelao que un calvo afeitao


En to lo coro ta vecaoO

De to la botella se han echao

GuchaOoo guácharo guáchao

Taa taaa taannn  ma pelao
Tan ma pelao
Tan ma pelao
Tan ma pelao
Ta tan ma pelao que un calvo afeitao

Taa taaa taannn  ma pelao
Tan ma pelao
Tan ma pelao
Tan ma pelao
Ta tan ma pelao que un calvo afeitao


San2bal en los controles


Ello tan (como la vaca de nena)

Ello tan (como la vaca de nena)

Ello tan (como la vaca de nenaj

Que en vez de dar leche lo que dan pena

Ello tan (como la vaca de nena)

Ello tan (como la vaca de nena)

Ello tan (como la vaca de nena)

Que en vez de dar leche lo que dan pena


A jajajajaja

Dynastic Music

La verdadera compañía

Enyer One

This is Lampo

DS Studios

Anegraph

Pineda Mayor

Mayimbu el hombre de el código

Mao en la casa

Dj kable

Dj chupa"
33658686,Furèsta,Tremm',5,,2025,Italy,"Electronic, Folk, World, & Country","Folk, Experimental, Antifolk",La Niña (2),discogs,
33658686,Furèsta,Chiena 'E Scippe,6,,2025,Italy,"Electronic, Folk, World, & Country","Folk, Experimental, Antifolk",La Niña (2),discogs,
33658686,Furèsta,Mammamà,7,,2025,Italy,"Electronic, Folk, World, & Country","Folk, Experimental, Antifolk",La Niña (2),discogs,
33658686,Furèsta,Figlia D' 'A Tempesta,8,,2025,Italy,"Electronic, Folk, World, & Country","Folk, Experimental, Antifolk",La Niña (2),discogs,
33658686,Furèsta,Sanghe,9,,2025,Italy,"Electronic, Folk, World, & Country","Folk, Experimental, Antifolk",La Niña (2),discogs,"1 ContributorQuisqueyano Vol. 4 1/2 Lyrics[Letra de ""Quisqueyano Vol. 4 1/2""]

[Intro]
Debería estar feliz, pero me da pena
Como en un país que presume ser casto, los hospitales están llenos de adolescentes embarazadas
Vender basura en las cafeterías de los colegios es negocio, pero dar preservativos a los muchachos es pecado
Fingimos estar en contra del abuso doméstico, pero subimos a diario en las redes sociales peleas y estrellones hasta de niños
Es verdad que el hombre ha fallado contra la mujer
Pero también es verdad que un gran número de mujeres hoy defienden su costo y no su valor
Soy quisqueyano

[Verso 1: [?]]
Bienvenido everybody a Santo Domingo (Ah)
Ahora hagan ruido pa' la tierra que nací yo (Wuh)
Yo siempre represento la República, no bregamo' duplica' (Ah)
Por eso somo' grande', libre y única (Ajá)
Y no tenemo' nada que envidiarle a Miami (No)
Aquí hay Lamborghinis, [?] y Ferraris (Yao'; ey)
¿Tú no sabe' porque yo no 'toy en lo' Grammys? (What?)
Porque ello' me agarra'n y desporta'n, y se salvaron, qué salami
Soy un lío, yo solo lo que le' estoy dando hilo
Si 'toy corto de efectivo voy a entrarle a ese bolsillo
Aquí no hay leye', todo el mundo hace lo que quiere
De Lo' Mina' a Guachupita, La Cañita a Lo' Mameye' (Ah)
¿Qué tú dice'? ¿Quiere' que lo' lobo' te visiten?
Aquí hay un socio que convierte la' pasola' en un 15 (Shh)
Quizá somo' un poco ignorante'
Pero tenemo' la mente brillante, semejante al diamante (Ah)


[Verso 2: Tinyo RD]
Yo tengo letra' hirviendo, metía' adentro 'e una olla
Nico hizo una vaina criolla como sábila y cebolla
Contranspira con mi patria, el cocote se te degolla
Caval, volví con espada dispuesto a hacerle la bolla
Al que se enriquece del gobierno
Trujillo, ven a ve' todo' esto' ladrone' y su' problema' interno'
[?], muro' interno' porque no tenía comida
Se enganchó una tabla arriba y salió a busca' su sueldo
Tú ere' de la rabia de un caudillo
Cuando veo to' lo' impuesto' que 'tamos pagando lo que me quillo
ITBIS hasta pa' singa' a un grillo y le' pusieron contandore'
A la lu' y la' balanza' que 'tán en el Capotillo (Ya tú sabe')
Quítense la venda de ignorante'  (Ajá)
O en su propia isla serán inmigrante'
Eso es algo denigrante (Ah, ah)
No vendo mi derecho, prefiero morir de hambre
Y te mato por mi bandera, aunque te suene ignorante

[Verso 3: [?]]
No contaban con mi astucia, como el Chapulín
Dominicano defiende su patria hasta con un colín
Fui recluso en el penal de La Victoria, no me doble en un motín
Se me respeta hasta en San Quintín
Hagan el saludo, la nueva o la vieja, no e' coba
Tabla pa'l virao' y pa' la' bruja' lo' palo' de escoba
Vengo de un sector donde se vende, se fuma y se roba
Represento el patio, la mafia boba
Saco la cara por mi bandera, no como otro' en Europa
Tengo un punto en piso que ocupo, bebo con [?]
Tienen que mamarmelo, son traicionero'
¿Te me va' a dobla'? Yo me comí la familia de un dembowsero
Pregúntale a Nico, que la base la desbarato
Que en el do' yo se lo' demostré, en esta lo' pongo en 4
Desaboyo gracia' a la marulla, no tengo un contrato (No)
Mi' letra' tienen código', descifren garabato'


[Verso 4: Nino Freestyle]
Yah
Dominicano soy, así que, alza tu brazo
Nueva escuela represent, coñazo, a Nino abranle paso (Ajá)
Que cuando yo monte este pedazo
Voy a quedar en la historia como cuando Mella soltó el trabucazo
¿Y tu hermanita cómo 'tá?
Se pasó y la puse a que me dé una abuela, la mamá de la mamá
Sueño con tene' dinero en cantida'
Y voy a salir de la olla cuando alguien venga y la deje destapa' (Yah)
Se lo' 'toy metiendo a to', así que, deja el teatro (Yah)
Que alante de mí se ven novato' (Sí)
Sin firma' contrato, yo soy el chamaco
Que en solo do' minuto' rompe en tre' Quisqueyano 4 (Rrr)
Maltrato a to' el guaremate que se vira (Sí)
Y al que no, lo tengo en la mira
Si Jesu' murió por la verdad crucificao'
Imaginate desgraciao' cómo va a morir tú por habla' mentira

[Verso 5: Villanosam]
Ustede' se pueden llena' su boca de to' lo que tiene su corazón
Y no importa, yo sigo siendo yo, yo soy Villanosam, manito
Nico haciendo historia con Quisqueyano 4
Yo tengo que ser parte de la historia también (Ey)
Dizque ""¿La cotorra pa' cuándo?""
Tu odio no te deja ve', 'tán volando
Tú lo que tiene' que deja' de 'tá mamando
Tú siempre quiere' 'tá criticando
Se nota que la envidia te 'tá matando, ah
Pana, tú vive' amargao', odiando
¿Quién diablo' ere' tú pa' 'tarme cuestionando?
E' má', te vo'a da' banda, tú sigue escuchando
Mientra' el tabaco yo lo sigo enrolando
Sígueme difamando (-mando)
Tú ere' un envidioso, lo sé, te 'toy sofocando (-cando)
Muchísimo' que quisieran 'tá aquí, que 'tán preocupao' (-ao')
Lo' veo haciendo cuenta' falsa' 'e haters, 'tán quillao' (Dice)
¿Qué le puede' mete' mejor que Villano? (Jaja)
Nico te hubiera llamao' pa' que 'tuviera aquí, en el 4, je
Dizque que tú en el rap ere' el má' asesino (Coño)
Tú lo que ere' un farsante, deja el teatro, no mame'
Que ustede' saben que comoquiera yo voy a coronarme
Que yo soy quisqueyano valiente y tu veneno no va a pararme
Esto es Quisqueyano 4, mi pana, yo no cambio, a mí hay que matarme (Oye)
Cuando esta vaina explote despué' no vengan a lamberme


[Verso 6: [?]]
Esta es la hora cero, todo el mundo atento
Que llegaron lo' leone' de esta selva de cemento
Lo' tigers 'tán activo', lo' mono' 'tán hambriento'
Yo me mantengo chivo y activo en el movimiento
Volví sobrao' de rima y por eso reparto
Ahora soy principal (Yah), ya no actor de reparto
Como no confío en banco, guardo lo' cuarto' en un banco
Y en el rap soy como era Kobe, letal en el cuarto cuarto
Llega'n lo' quisqueyano, so sientan el torque
Sellen lo' pasaporte', que esto va de Euro pa'l norte
El beat de Nico es el medio de instrumental
Por el cual trafico este rap que baja sin corte
Esta es la selección de toda una nación
Que cuando coge el bate pone al mundo en atención
Tenemo' una única misión, se' el ejemplo de superación
De toda esta nueva generación, ah

[Verso 7: [?]]
Yi, hah, okay, dice
Cada ve' que maquino (Wuh), doy agua de bebe' si me amotino
Y dicen que 'toy abusando, que así no
Ando mangando mujere' fina' como el lino
Así que, frontee' pa' otro lao', pero como Carolin Aquino
No force', que te pico, monto voce' en este disco
Tráete broncochem, que te vo'a da' que tose' si te ubico
Y te explico, [?], eso no fue [?]
Tiene que echarle to' la culpa a Nico
E' que a nivel de letra rompo liga y mato sin pretexto
Si me dejan de entra' me voy adueñar de esto
Y aunque te detesto, ahí si tú serás un nigga
Porque tú ni gana' ni recuperas el puesto
Ahora-ahora-ahora-ahora-ahora-ahora-ahora-ahora
Le' toca' choca' con este artista
Uste' no e' de na', deje de habla' baba
Es que cualquiera volleyball con la malla bajita
Quiere decir que tú era' duro cuando yo no estaba

[Verso 8: Gailen La Moyeta]
Yao'
Soy de RD, dominicana quisqueyana, ¿qué fue?
Joseadora, si hay una vuelta me computo por tre'
Tengo a má' de treinta aquí desde que entré
Porque desde que entré fue montando la de caché
En mi bloque, to' mueven caldero, ninguno' son Ché
Lo' menore' loco' con su Sprite y su broncochem
Par de haters que de mi lista taché
Mientra' yo hago mi cuarto, sigan jugando parché
Yo no 'toy en gente, no 'toy en nadie, no 'toy en ti
Yo to' lo' día saliendo en boletín
Siempre con mi team armando el motín con un maletín
Y tú nunca llega' a na' por má' que da' ese fullín, jajaja

[CONTINUAR]"
33658686,Furèsta,Pica Pica,10,,2025,Italy,"Electronic, Folk, World, & Country","Folk, Experimental, Antifolk",La Niña (2),discogs,
33113217,Arimanius Ignis Ater,Apaxtarat Haca Naemat,1,7:38,2025,Greece,Electronic,"Ambient, Dark Ambient","Corona Barathri, Akhtya",discogs,
33113217,Arimanius Ignis Ater,Paityara Aeshma Serpens Ater,2,8:25,2025,Greece,Electronic,"Ambient, Dark Ambient","Corona Barathri, Akhtya",discogs,
33113217,Arimanius Ignis Ater,Anaghra Temah 0,3,8:10,2025,Greece,Electronic,"Ambient, Dark Ambient","Corona Barathri, Akhtya",discogs,
33113217,Arimanius Ignis Ater,Templum Ignis Impuri,4,14:56,2025,Greece,Electronic,"Ambient, Dark Ambient","Corona Barathri, Akhtya",discogs,
33113217,Arimanius Ignis Ater,Cesmag,5,8:29,2025,Greece,Electronic,"Ambient, Dark Ambient","Corona Barathri, Akhtya",discogs,
33113217,Arimanius Ignis Ater,Duzakh Cd Master,6,9:57,2025,Greece,Electronic,"Ambient, Dark Ambient","Corona Barathri, Akhtya",discogs,
33113217,Arimanius Ignis Ater,Daewayaz,7,13:34,2025,Greece,Electronic,"Ambient, Dark Ambient","Corona Barathri, Akhtya",discogs,
33113217,Arimanius Ignis Ater,Anastih,8,5:44,2025,Greece,Electronic,"Ambient, Dark Ambient","Corona Barathri, Akhtya",discogs,
33408551,Eschaton Magicks,Stygian Nightmare,1,,2025,Portugal,Rock,Black Metal,Nachash (2),discogs,
33408551,Eschaton Magicks,Sojourner Of The Dark Passage,2,,2025,Portugal,Rock,Black Metal,Nachash (2),discogs,
33408551,Eschaton Magicks,The Scythewielder,3,,2025,Portugal,Rock,Black Metal,Nachash (2),discogs,
33408551,Eschaton Magicks,Eschaton Magicks,4,,2025,Portugal,Rock,Black Metal,Nachash (2),discogs,
33408551,Eschaton Magicks,Death's Mordant Blaze,5,,2025,Portugal,Rock,Black Metal,Nachash (2),discogs,
33408551,Eschaton Magicks,Empyrean Graves,6,,2025,Portugal,Rock,Black Metal,Nachash (2),discogs,
33408551,Eschaton Magicks,Wherein The Devil Dwells,7,,2025,Portugal,Rock,Black Metal,Nachash (2),discogs,
33556944,No Escape,The Pulse,1,2:48,2025,Belgium,Blues,,Fred And The Healers,discogs,
33556944,No Escape,Wise Man,2,3:40,2025,Belgium,Blues,,Fred And The Healers,discogs,
33556944,No Escape,Big Bang,3,2:36,2025,Belgium,Blues,,Fred And The Healers,discogs,
33556944,No Escape,Another Fall,4,5:30,2025,Belgium,Blues,,Fred And The Healers,discogs,
33556944,No Escape,The Escape,5,3:07,2025,Belgium,Blues,,Fred And The Healers,discogs,
33556944,No Escape,Love Jungle,6,2:58,2025,Belgium,Blues,,Fred And The Healers,discogs,
33556944,No Escape,Lonesome Light,7,4:37,2025,Belgium,Blues,,Fred And The Healers,discogs,
33556944,No Escape,Blood And Guts,8,3:37,2025,Belgium,Blues,,Fred And The Healers,discogs,
33556944,No Escape,A Fool's Journey,9,3:45,2025,Belgium,Blues,,Fred And The Healers,discogs,
33556944,No Escape,Back To Basics,10,4:11,2025,Belgium,Blues,,Fred And The Healers,discogs,
33556944,No Escape,The Deputy Manager,11,4:34,2025,Belgium,Blues,,Fred And The Healers,discogs,
33556944,No Escape,No Love For Old Men,12,4:02,2025,Belgium,Blues,,Fred And The Healers,discogs,
33522299,The Party Never Ends,The Party Never Ends,1,,2025,Europe,Hip Hop,,Juice WRLD,discogs,"45 ContributorsTranslationsEspañolУкраїнськаРусский (Russian)The Party Never Ends LyricsThe first track on Juice WRLD’s “The Party Never Ends” sets the tone for his final album, featuring Juice’s signature introspective style, blending themes of partying, suspenseful melodies and personal… Read More [Intro: Juice WRLD & Mike P]
Set the stage
As soon as he hits, set the stage, that's when he carry
When the beat drops though, pssh, shit, it's gonna sound lit
Get your cellphone light up right now, put it up
Only cellphone lights, please
If you fuck with Juice WRLD, put it up a little bit higher
If you love Juice WRLD, put it up a little bit higher
If you fuck with Juice WRLD, raise your lights right now pleaseThis show, niggas is not performin' like this no more, bro, like
These are the tickets? Fuck rent, fuck my landlord, fuck everything, nigga, Juice WRLD, nigga, I'm telling you
I said it first, the party never ends
Yeah

[Chorus: Juice WRLD]
I see in the dark (In the dark, yeah), yeah
Perky tearin' me apart (Tear me apart, yeah), yeah
Tell them drugs to play they part (Play they part, play they part), yeah
Let the party start (Let the fucking party start, yeah), hah
I see in the dark (In the dark, yeah), yeah
Perky tearin' me apart, part (Tearing me apart, yeah), yeah
Tell them drugs to play they part (Playin' they partmotherfuckin' part, yeah), hah
Relax and let the party start (Yeah, yeah), yeah

[Outro: Juice WRLD]
(In the dark, yeah, yeah)
I said it first, the party never ends (Never ends, yeah, yeah), yeah
Relax and let the party start (Yeah, yeah)
(Yeah, yeah, yeah)
I know you had your ways for a couple of days
They say life is a book, well, I'm turning the page
I'm not looking back at it at all, I'm gone
I'ma see you on the other side, yeah, yeah
(I said it first, the party never ends)
I'ma see you on the other side, yeah, yeah
(I said it first, the party never ends)
I'ma see you on the other side, yeah, yeah"
33522299,The Party Never Ends,Misfit,2,,2025,Europe,Hip Hop,,Juice WRLD,discogs,"55 ContributorsTranslationsDeutschEspañolУкраїнськаMisfit LyricsOn “Misfit,“ Juice WRLD raps about his desire to get money, women, and live a nonchalant lifestyle.

During the celebration of Juice WRLD Day on December 16, 2023, a fan asked Juice WRLD’s manager, Lil Bibby,… Read More [Intro]
Ayy, ayy
Oh, oh-oh
Yeah, yeah, yeah, woah

[Chorus]
Ayy, one main girl, fuck a mistress, oh (Ayy)
Heart still hurt, like a wrist slit, oh (Ayy)
I don't fit in, I'm a misfit, oh (Ayy)
First thing on my mind, that's to get rich, oh (Ayy)
One main girl, fuck a mistress, oh (Ayy)
Heart still hurt, like a wrist slit, oh (Ayy)
I don't fit in, I'm a misfit, oh (Ayy)
First thing on my mind, that's to get rich, oh

[Verse 1]
I'm a misfit, that means I don't fit, nah, I don't fit in
I just bought a coupé, baby girl, get in
Lord, forgive me, I know I'ma sin tonight
Probably get high with my friends tonight
Have a ménage in the Benz tonight (Yeah)
Probably go and fuck on some twins tonight
Pop a Xanax, so I'll forget tonight (Yeah, tonight)
Went to L.A., almost missed my flight twice (Yeah, yeah, twice)
I was off the Xans that night, right (Right)
Almost died on 'em, that's the last flight (Flight)
I was pretty cool in my last life (Life)


[Chorus]
Ayy, one main girl, fuck a mistress, oh (Ayy, ayy)
Heart still hurt, like a wrist slit, oh (Yeah, ayy)
I don't fit in, I'm a misfit, oh (Yeah, ayy)
First thing on my mind is to get rich, oh (Ayy)
One main girl, fuck a mistress, oh (Ayy)
Heart still hurt, like a wrist slit, oh (Ayy)
I don't fit in, I'm a misfit, oh (Ayy)
First thing on my mind, that's to get rich, oh

[Verse 2]
Yeah, yeah, ayy
Xanny turnin' me into a beast (Uh, uh)
Don't make me call them niggas from over east (Ayy)
They'll probably put you in the street (Uh, yeah, ayy)
Make a motherfucker hit his feet
Tell them niggas, ""Check my swag""
Yours too bad, take that back
I quit drugs, then relapse
I run back, like gym class
Brand new bitch, I need it (Uh, ayy)
If it's too good, I'll keep it
Be my Victoria's Secret
Be my Victoria's Secret, yeah

[Chorus]
Ayy, one main girl, fuck a mistress, oh (Ayy)
Heart still hurt, like a wrist slit, oh (Yeah)
I don't fit in, I'm a misfit, oh (Ayy)
First thing on my mind, that's to get rich, oh (Ayy)
One main girl, fuck a mistress, oh (Ayy)
Heart still hurt, like a wrist slit, oh (Ayy)
I don't fit in, I'm a misfit, oh (Ayy)
First thing on my mind, that's to get rich, oh"
33522299,The Party Never Ends,AGATS2 (Insecure),3,,2025,Europe,Hip Hop,,Juice WRLD,discogs,"76 ContributorsTranslationsPortuguêsУкраїнськаРусский (Russian)EspañolAGATS2 (Insecure) Lyrics“AGATS2 (Insecure)” sees Juice WRLD and Nicki Minaj collaborate for the lead single to Juice WRLD’s The Party Never Ends. The track is labeled as the follow-up to Juice’s 2017 hit “All Girls Are the Same.”
… Read More [Intro: Juice WRLD & Nicki Minaj]
All stand up, oh (Woah)
Oh
(Is there any way? Is there any way?) All stand up, oh

[Verse 1: Juice WRLD & Nicki Minaj]
I admit it, another ho got me finished
Tryna serve heartbreak up like tennis
Fuck sipping, I'ma codeine gargle
Babysitter, she gon' give my kids a swallow
And her nigga hating, got a gun full of hollows
Load that bitch up, he won't live to see tomorrow
Still tripping, on fire, I'm blazin'
Inhale, it's Friday the 13th and guess who playing Jason

[Chorus: Juice WRLD]
And your insecurities
Will get the best of me
Your insecurities
Will get the best of me
And your insecurities
Will get the best of me
Your insecurities
Will get the best of—

[Verse 2: Nicki Minaj, Juice WRLD, Nicki Minaj & Juice WRLD]
Bitches screaming, ""Demon time"" like they was possessed
Let's keep it real, bitch, you know you was just obsessed (But it's no)
Bad women, no good, bad women
Hotel rooms and Versace linens
Wake up in the morning, scrambling for some Advil
Last night, last night was too mad real
In love with the downers, so I took some sad pills
Jack Daniel's don't hold me still


[Bridge: Juice WRLD & Nicki Minaj, Juice WRLD, & Nicki Minaj]
Nothing like the plane ride home
I really hate the plane ride home (Oh)
I'm in L.A. right now
Left the heartbreak in Chicago

[Chorus: Juice WRLD & Nicki Minaj, Juice WRLD]
And your insecurities
Will get the best of me
Your insecurities
Will get the best of me
And your insecurities
Will get the best of me
Your insecurities
Will get the best of me

[Verse 3: Nicki Minaj]
None of these niggas can't fuck with you
What's up with you?
Insecure, me? Nah, that be you
I left all of them to come after you
She want good brain, gotta be the muscle too
He want the smart girl, gotta be a hustler too
Hoes can't fuck with me and that's just the truth
Somebody gotta teach her class like a substitute


[Bridge: Nicki Minaj]
Is there any way? Is there any way
We could be mindful of what we say?
Is there any way? Is there any way
That you would book a different plane, say you'll stay?

[Chorus: Juice WRLD & Nicki Minaj]
And your insecurities
Will get the best of me (Say you'll stay)
Your insecurities
Will get the best of me (Say you'll stay)

[Outro: Halsey]
These thoughts in my brain (Say you'll stay)
All girls are the same (Say you'll stay)
You should stay here with me (These thoughts in my brain)
Say you'll stay"
33522299,The Party Never Ends,Lace It,4,,2025,Europe,Hip Hop,,Juice WRLD,discogs,"191 ContributorsTranslationsفارسیDeutschРусский (Russian)MagyarEspañolPortuguêsLace It Lyrics“Lace It” sees the reunition of Juice WRLD and Eminem over a bass-filled benny blanco production, while also serving as the lead single of Juice WRLD’s final posthumous album, The Party Never Ends. On the… Read More [Intro: Juice WRLD]
Yeah, ayy, mm

[Chorus: Juice WRLD]
Roll it up, lace it, pop a few to chase it
I'm in my own Matrix, none of this shit makes sense
All these humans basic, don't got no home trainin'
Codeine by the cases, I've been purple rainin'
Roll it up, lace it, pop a few, chase it
I've been in the Matrix, none of this shit makes sense
All you humans basic, you ain't even got home trainin'
Codeine by the cases, I've been purple rainin'

[Verse 1: Juice WRLD]
Stressed out, so I tend to take meds (Take meds)
Thе Devil told me, ""Good show, break a lеg"" (Break a leg)
All these painkillers like I got a pair of broken legs (Broken legs)
All these Percs I pop, you'd thought I was plannin' to break my neck
Grindin', man, I'm hungry for this shit like I ain't ate yet
You wish that you could have what I could have, you could just say that
If you ain't my lil' bitch, then bitch, them convos, you can save that
These niggas think they invincible 'til they see them bullet holes in they Maybach

[Chorus: Juice WRLD & Eminem]
Roll it up, lace it, pop a few to chase it
I'm in my own Matrix, none of this shit makes sense
All these humans basic, don't got no home trainin'
Codeine by the cases, I've been purple rainin'
Roll it up, lace it, pop a few, chase it
I've been in the Matrix, none of this shit makes sense
All you humans basic, you don't even got home trainin'
Codeine by the cases (Yeah), I've been purple rainin'


[Verse 2: Eminem]
You pop some ecstasy first, it gets progressively worse (Yeah)
Try your best to reverse (No), unsuccessfully flirtin' with certain death
And revertin' to your promethazine urge
The fuckin' devil, he lurks, lose your best friend, he smirks
Wake up and everything hurts (Ow)
And as you spiral downward, listen (Yeah)
I know just how it is when (What?)
You start slow, then before you notice it, now you're mixin' (What?)
Oxy's without prescription (Yeah)
Cough medicine, valium with 'em (Damn)
But ain't that how addiction sort of works (Uh)
They call it lean 'cause you gravitate and lean towards the purp
The blessing or the curse of fame
'Cause now you can afford the syrup (Damn)
Percocet and Percodan, but that ain't what you meant
When you said that you're in it for the perks (Nah, damn)
Develop a habit out of that
Need a Xanax now to rap
So you pop it 'fore you record a verse (Ah)
Your buzz wear down, yeah
Like a rabbit out a hat makes you wanna pull your hair out (Ha)
Fentanyl (Yep), Oxy (What?)
Demerol, them are all what possibly got Shock G, Roxy
Codone and lean is probably what got Lil Peep and ODB
So many who OD be way too young to go
See me, I was lucky, my escape was narrowin'
Do not think I take it for granted, that I'm still here
Synthetic heroin, you (What?) tried to kill me, then you
Murdered Jarad, didn't you? Piece of shit
Thanks to you, now we lost Gangsta Boo and Pimp C, Prince, and Michael, mixing Nyquil
With prescription Vic's, addiction's like a fucking vicious cycle
Juice, we will forever miss you
To the younger generation (Nah)
I ain't lecturing you, but man, just be careful when you


[Chorus: Juice WRLD]
Roll it up, lace it, pop a few to chase it
I'm in my own Matrix, none of this shit makes sense
All these humans basic, don't got no home trainin'
Codeine by the cases, I've been purple rainin'
Roll it up, lace it, pop a few, chase it
I've been in the Matrix, none of this shit makes sense
All you humans basic, you don't even got home trainin'
Codeine by the cases, I've been purple rainin'

[Outro: Juice WRLD]
I ain't comin' down from this high
Ain't finna let nobody kill my vibe
They committed social suicide
But me? I refuse to die (I refuse to die)
I will never come down from this high
I won't let them kill none of my vibes
They committed social suicide
Me? I can never ever die, I can never ever die"
